{
  "$schema": "metalui/gadget@1",
  "name": "ink-well", "title": "Draw",
  "job": "make", "feel": { "v": 0.9, "a": 0.9, "w": 0.1 }, "container": "slab", "station": 330, "material": "ceramic",
  "parts": [
    { "id": "body", "part": "slab", "at": [200, 196], "size": [320, 320], "role": "body" },
    { "id": "lamp", "part": "led",  "at": [313, 78],  "role": "lamp" },
    { "id": "well", "part": "slab", "at": [200, 244], "size": [96, 96], "role": "cut", "material": "ceramic", "params": { "cut": "hole", "depth": 18, "ink": true } },
    { "id": "nib",  "part": "nib",  "at": [200, 236], "size": [150, 44], "role": "actor", "params": { "angle": -16 } }
  ],
  "mechanism": { "name": "dip", "bind": { "nib": "nib", "well": "well", "lamp": "lamp" }, "drive": "writing" },
  "ports": { "in": { "writing": { "kind": "boolean", "default": false } } },
  "states": {
    "rest":    { "lamp": ["off", "steady"], "hint": "ready" },
    "writing": { "lamp": ["live", "steady"], "enter": "act", "form": { "nib": { "pose": { "y": 6 } } }, "hint": "writing" }
  },
  "describe": "{title}"
}
