{
 "$schema": "metalui/gadget@1",
 "name": "step-row",
 "title": "Step row",
 "job": "signal",
 "feel": {
  "v": 0.6,
  "a": 0.05,
  "w": 0.6
 },
 "container": "slab",
 "station": 80,
 "material": "ceramic",
 "parts": [
  {
   "id": "body",
   "part": "slab",
   "at": [
    200,
    200
   ],
   "size": [
    384,
    132
   ],
   "role": "body"
  },
  {
   "id": "lamp",
   "part": "led",
   "at": [
    362,
    162
   ],
   "role": "lamp"
  },
  {
   "id": "tray",
   "part": "slab",
   "at": [
    184,
    214
   ],
   "size": [
    318,
    56
   ],
   "role": "cut",
   "params": {
    "cut": "tray",
    "depth": 12,
    "radius": 18
   }
  },
  {
   "id": "light",
   "part": "backlight",
   "at": [
    184,
    214
   ],
   "size": [
    318,
    56
   ],
   "role": "trim",
   "params": {
    "shape": "glow",
    "color": "glass"
   }
  },
  {
   "id": "cells",
   "part": "cell",
   "at": [
    184,
    214
   ],
   "size": [
    32,
    32
   ],
   "role": "actor",
   "params": {
    "cols": 8,
    "rows": 1,
    "gap": 6
   }
  }
 ],
 "mechanism": {
  "name": "glow",
  "bind": {
   "cells": "cells",
   "light": "light",
   "lamp": "lamp"
  },
  "drive": "fill"
 },
 "ports": {
  "in": {
   "fill": {
    "kind": "number",
    "min": 0,
    "max": 8,
    "default": 0
   }
  },
  "out": {
   "full": {
    "kind": "boolean"
   }
  }
 },
 "states": {
  "rest": {
   "lamp": [
    "off",
    "steady"
   ],
   "hint": "dark"
  },
  "filling": {
   "lamp": [
    "live",
    "steady"
   ]
  },
  "full": {
   "lamp": [
    "live",
    "steady"
   ],
   "hint": "full"
  }
 },
 "initial": "rest",
 "describe": "{title}: {value} of 8 steps"
}
